{
  "schema_version": "1.0.0",
  "kind": "backend-contract",
  "contract": {
    "id": "authentication-api-client-observation",
    "title": "Authentication API client-observed contract",
    "version": "1.0.0",
    "status": "implemented",
    "description": "Contract evidenced by the active Angular client. It proves implemented client expectations, not a verified-live server."
  },
  "sources": [
    {
      "id": "forgot-password-api-source",
      "kind": "legacy-code",
      "authority": "observational",
      "status": "implemented",
      "snapshot_uri": "libs/authentication/data/src/lib/sources/forgot-password.api.ts",
      "sha256": "c71f49a58878e348a259703d027fbdb7e0177639772d2b726f577e9d2086abae"
    },
    {
      "id": "authentication-endpoints-source",
      "kind": "legacy-code",
      "authority": "observational",
      "status": "implemented",
      "snapshot_uri": "libs/authentication/data/src/lib/endpoints/authentication.endpoints.ts",
      "sha256": "56a82a226a790da0129658228ca12ae4ece17ed8f8adc41b3a07352d019c479c"
    },
    {
      "id": "forgot-password-request-dto-source",
      "kind": "legacy-code",
      "authority": "observational",
      "status": "implemented",
      "snapshot_uri": "libs/authentication/data/src/lib/dtos/forgot-password-request-api.dto.ts",
      "sha256": "fb6e338e1d2be8a55f934174a2e9e01003c678dd62f54e30da0774f396c83fdf"
    },
    {
      "id": "forgot-password-response-dto-source",
      "kind": "legacy-code",
      "authority": "observational",
      "status": "implemented",
      "snapshot_uri": "libs/authentication/data/src/lib/dtos/forgot-password-response-api.dto.ts",
      "sha256": "1a19b864fbd8afd5c3287a5fa0bc871a51639c9cf168fdb737f6a2aa790456d6"
    },
    {
      "id": "simple-response-dto-source",
      "kind": "legacy-code",
      "authority": "observational",
      "status": "implemented",
      "snapshot_uri": "libs/shared/data/src/lib/dtos/simple-response.dto.ts",
      "sha256": "cba0b8c0db95ca80c36f4bf2ec4a7dd239107807d7ab216ed5abb692ded8ee90"
    },
    {
      "id": "auth-interceptor-source",
      "kind": "legacy-code",
      "authority": "observational",
      "status": "implemented",
      "snapshot_uri": "apps/backoffice-angular/src/app/interceptors/auth.interceptor.ts",
      "sha256": "27649aacfb12f0ad945f48bf25081d349ea1ebdcb3ac35a0bc9af57c3de6909e"
    },
    {
      "id": "authentication-test-config-source",
      "kind": "legacy-code",
      "authority": "observational",
      "status": "implemented",
      "snapshot_uri": "apps/backoffice-angular/src/app/testing/a11y-testbed.harness.ts",
      "sha256": "884de82dfb6d67151530dae8a9e24ce2538b7b4f43ab4f56768dede6630cba43"
    }
  ],
  "services": [
    {
      "id": "authentication-api",
      "status": "implemented",
      "description": "Authentication service consumed through the runtime AUTH_API_URL token.",
      "base_urls": [
        {
          "environment": "test",
          "url": "https://test.invalid/auth/"
        }
      ],
      "evidence": [
        {
          "source_id": "authentication-test-config-source",
          "locator": "$.authenticationUrl"
        },
        {
          "source_id": "forgot-password-api-source",
          "locator": "ForgotPasswordApi.baseUrl"
        }
      ]
    }
  ],
  "security_schemes": [],
  "models": [
    {
      "id": "forgot-password-request-wire",
      "kind": "object",
      "status": "implemented",
      "description": "Payload expected by the forgot-password client call.",
      "fields": [
        {
          "name": "email",
          "description": "Account email address.",
          "required": true,
          "nullable": false,
          "type": { "kind": "primitive", "name": "string" },
          "evidence": [
            {
              "source_id": "forgot-password-request-dto-source",
              "locator": "ForgotPasswordRequestApiDto.email"
            }
          ]
        }
      ],
      "evidence": [
        {
          "source_id": "forgot-password-request-dto-source",
          "locator": "ForgotPasswordRequestApiDto"
        }
      ]
    },
    {
      "id": "forgot-password-result-wire",
      "kind": "object",
      "status": "implemented",
      "description": "Data carried by the forgot-password response envelope.",
      "fields": [
        {
          "name": "message",
          "description": "Password reset request result message.",
          "required": true,
          "nullable": false,
          "type": { "kind": "primitive", "name": "string" },
          "evidence": [
            {
              "source_id": "forgot-password-response-dto-source",
              "locator": "ForgotPasswordItemApiDto.message"
            }
          ]
        }
      ],
      "evidence": [
        {
          "source_id": "forgot-password-response-dto-source",
          "locator": "ForgotPasswordItemApiDto"
        }
      ]
    }
  ],
  "operations": [
    {
      "id": "authentication.forgot-password",
      "service_id": "authentication-api",
      "status": "implemented",
      "description": "Requests password-reset instructions for an email address.",
      "method": "POST",
      "path": "/forgot-password",
      "access": {
        "mode": "public",
        "security_scheme_ids": [],
        "permissions": []
      },
      "request": {
        "parameters": [],
        "body": {
          "required": true,
          "media_types": ["application/json"],
          "model_id": "forgot-password-request-wire",
          "evidence": [
            {
              "source_id": "forgot-password-api-source",
              "locator": "ForgotPasswordApi.execute(dto)"
            },
            {
              "source_id": "forgot-password-request-dto-source",
              "locator": "ForgotPasswordRequestApiDto"
            }
          ]
        }
      },
      "responses": [
        {
          "status": 200,
          "outcome": "success",
          "description": "Password-reset request accepted.",
          "body": {
            "media_type": "application/json",
            "model_id": "forgot-password-result-wire",
            "envelope": {
              "kind": "object",
              "data_field": "data",
              "error_field": "error",
              "message_field": "message"
            },
            "evidence": [
              {
                "source_id": "forgot-password-response-dto-source",
                "locator": "ForgotPasswordResponseApiDto"
              },
              {
                "source_id": "simple-response-dto-source",
                "locator": "SimpleResponseDto<T>"
              }
            ]
          },
          "evidence": [
            {
              "source_id": "forgot-password-api-source",
              "locator": "HttpClient.post<ForgotPasswordResponseApiDto>"
            }
          ]
        }
      ],
      "evidence": [
        {
          "source_id": "forgot-password-api-source",
          "locator": "ForgotPasswordApi.execute"
        },
        {
          "source_id": "authentication-endpoints-source",
          "locator": "AUTHENTICATION_ENDPOINTS.FORGOT_PASSWORD"
        },
        {
          "source_id": "auth-interceptor-source",
          "locator": "authInterceptor SKIP_AUTH branch"
        }
      ]
    }
  ]
}
